"unit_id","category","description","rated_capacity","rated_capacity_unit","throughput_limit","throughput_limit_unit","control_devices"
"EU-1A","storage","Denatured Ethanol Storage Tank/3 million gallons","","","450000000","gallons per 12-month rolling period","CE-1A"
"EU-2A","storage","Storage Tank/1 million gallons","1000000","gallons","","","CE-2A"
"EU-2B","storage","Storage Tank/1 million gallons","1000000","gallons","","","CE-2B"
"EU-3","loading operation","Rail/Truck Load-out Operations","750","gallons per minute per pump","","",""
"EU-6","loading/unloading","Other Materials Loadout Operation","500000","gallons per minute","24000000","pounds per year","CE-6"
"EU-7","storage","Denatured Ethanol Storage Tank/3 million gallons","3000000","gallons","450000000","gallons per year","CE-7"
"EU-Roads","other","Gravel road emissions","","","","",""
"LL","other","Floating Roof Landing Losses for Emission Units 1A, 2A, and 2B","","","","",""
