"unit_id","category","description","rated_capacity","rated_capacity_unit","throughput_limit","throughput_limit_unit","control_devices"
"A01","handling","Elevator D Grain Handling System","250","tph","","","CEA01"
"A07","handling","Elevator A Hull Handling System","20","tph","","","CEA07"
"A13","handling","Elevator G Grain Handling System","360","tph","","","CEA13"
"A17","handling","Elevator G Grain Handling System","360","tph","","","CEA17"
"A18","handling","Elevator G Grain Handling System","360","tph","","","CEA18"
"A21","handling","Elevator G Grain Handling System","410","tph","","","CEA21"
"A37","handling","Elevator G Grain Handling System","360","tph","","","CEA37"
"A38","handling","Elevator G Grain Handling System","360","tph","","","CEA38"
"A39","handling","Elevator E/F Grain Handling System","250","tph","","","CEA39"
"A41","handling","Elevator G Basement Grain Handling System","","","","","CEA41"
"A42","grain_handling","Grain Handling System A with Fabric Filter Low","360","tph","","","CEA42A, CEA42B"
"A43","grain_handling","Grain Handling System B with Fabric Filter Low","360","tph","","","CEA43A, CEA43B"
"A44","grain_handling","Elevator G Basement Grain Handling System B with Baghouse","15","tph","","","CEA44"
"A71","grain_handling","Elevator A Bin Top & Bridge with Fabric Filter Low","410","tph","","","CEA71"
"A72","grain_handling","Elevator C Bin #3 (Northstar) Bottom; Bin #41 Top & Bottom with Fabric Filter Low","410","tph","","","CEA72"
"B04","baghouses","Corn Mill Cleaning House Process Baghouse","","","","","KICE M120-10"
"B07","fabric filter dust collector","Corn Mill Trim Cutter Paper Fabric Filter","40","ton/yr","","","CEB07"
"B08","baghouses","Corn Milling Process A, Mill A Baghouse","","","","","MAC 120AV341"
"B09","fabric filter dust collector","Corn Mill A General Fabric Filter","35","tph","70000","lb/hr","CEB09"
"B24","baghouses","Corn Milling Process Baghouse","","","","","not specified"
"B25","fabric filter dust collector","Corn Milling Process A & B, Mill B Fabric Filter","15","tph","","","CEB25"
"B26","fabric filter dust collector","Corn Milling Process A & B, Mill B Fabric Filter","15","tph","","","CEB26"
"B27","dust collector","Corn Milling Process A&B, Grits Processing Line Dust Collector","5850","lb/hr (wet basis)","","","B27"
"B28","dust collector","Corn Milling Process A&B, Grits Processing Line Dust Collector","5850","lb/hr (wet basis)","","","B28"
"B29","dust collector","Grits Drum Dryers #1-4 Exhaust Dust Collector","5850","lb/hr (wet basis)","","","B29"
"B30","dust collector","Grits Drum Dryers #5-8 Exhaust Dust Collector","5850","lb/hr (wet basis)","","","B30"
"B31","drying","Cooked Grits Dust Fabric Filter","","","5850","lb/hr (wet basis)","CEB31"
"B33","drying","Corn Mill B, Finished Product Dryer","15","tph","","","CEB33"
"B36","drying","Corn Mill Dry Mix Fabric Filter","4.4","tph","","","CEB36"
"D01, D02","drying","Primary Oat Aspiration #1 and #2 with Fabric Filters","15.4","tph","","","CED01, CED02"
"D04","aspiration","Oat aspiration system #3","","","15.4","tph","CED04"
"D05","aspiration","Oat aspiration system #2","","","15.4","tph","CED05"
"D08","dryer","Oat dryer/cooler #2","8","tph","","","CED08"
"D09","dryer","Oat dryer/cooler #3","8","tph","","","CED09"
"D10","dryer","Oat dryer/cooler #4","8","tph","","","CED10"
"D11","dryer","Oat dryer/cooler #5","8","tph","","","CED11"
"D12","dryer","Oat dryer/cooler #6","8","tph","","","CED12"
"D13","dryer","Oat dryer/cooler #7","8","tph","","","CED13"
"D14","fabric filter","Oat cleaning process system","65","tph","","","CED14"
"D15","aspiration","Oat aspiration system #1","15.4","tph","","","CED15"
"D16","aspiration","Oat aspiration system #2","15.4","tph","","","CED16"
"D17","packaging","Oats Transfer / Fabric Filter","","","","","CED17"
"D18","packaging","Secondary Large Oat Fabric Filter","15.4","tph","","","CED18"
"D19","packaging","Primary Stub Oat Fabric Filter","15.4","tph","","","CED19"
"D20","packaging","Secondary Stub Oat Fabric Filter","15.4","tph","","","CED20"
"D25","packaging","CH2 General Dust Fabric Filter","2.5","tph","","","CED25"
"D26","packaging","CH2 Grading Gravity Fabric Filter","2.5","tph per table","","","CED26"
"D27","packaging","Oat Bran Flour Bin-Fabric Filter","5","tph","","","CED27"
"D29","other","Not explicitly stated, but likely a fabric filter based on context","","","","","CE D29A, CE D29B"
"D30","packaging","Oat Flour Bliss Mill Fabric Filter","4","tph","","","CED30"
"D31","packaging","Oat Flour Filter Fabric Filter","4","tph","","","CED31"
"D32","packaging","Oat Flour Bliss Mill Fabric Filter","4","tph","","","CED32"
"D33","packaging","Oat Flour Filter Fabric Filter","4","tph","","","CED33"
"D47","fabric_filter","Fabric Filter for Oats Processing","","","11.4","tph","CED47A, CED47B"
"D49","fabric_filter","Fabric Filter for Oats Grading","","","15","tph","CED49A, CED49B"
"D50","fabric_filter","Fabric Filter for Oat Cleaning (Process System H)","65","tph","","","CED50A, CED50B"
"D51","fabric_filter","Fabric Filter for Oat Cleaning (Process System I)","65","tph","","","CED51A, CED51B"
"D52","fabric_filter","Fabric Filter for Oat Cleaning (Process System J)","65","tph","","","CED52A, CED52B"
"D53","fabric_filter","Fabric Filter for Oat Pro Processing (System)","0.5","tph","","","CED53A, CED53B"
"D60","fabric_filter","Fabric Filter for Hulls (Receiver #1)","13.25","tph","","","CED60"
"D61","fabric_filter","Fabric Filter for Hulls (Receiver #2)","13.25","tph","","","CED61"
"D62","fabric_filter","Fabric Filter for 300V Gravity Table Hulls (25 tph)","25","tph","","","CED62"
"D63","fabric_filter","Aspiration Filter for Hulls (Light Oats Primary)","12.25","tph","","","CED63"
"D64","fabric_filter","Aspiration Filter for Hulls (Light Oats Secondary)","8.45","tph","","","CED64"
"D65","fabric_filter","Filter Receiver for Hulls (3.8 tph)","3.8","tph","","","CED65"
"D66","fabric_filter","90V Gravity Table Hulls (6.5 tph)","6.5","tph","","","CED66"
"D67","fabric_filter","Aspiration Filter for Hulls (Heavy Oats Primary)","13","tph","","","CED67"
"D68","fabric_filter","Secondary Aspiration Filter for Hulls (15 tph)","15","tph","","","CED68"
"D69","fabric_filter","Filter Receiver for Hulls (4 tph)","4","tph","","","CED69"
"D71","fabric_filter","Aspiration Filter for Hulls (9 tph)","9","tph","","","CED71"
"D72","fabric_filter","Hulls (6.5 tph) Gravity Table (B Grade)","6.5","tph","","","CED72"
"D73","fabric_filter","Supply Cyclone Hulls (1.5 tph)","1.5","tph","","","CED73"
"D74","fabric_filter","Fabric Filter for Hulls (General Dust Collection #1)","26.5","tph","","","CED74"
"D75","fabric_filter","Fabric Filter for Hulls (General Dust Collection #2)","26.5","tph","","","CED75"
"D76","fabric_filter","Fabric Filter for Hulls (General Sanitation Vacuum System)","26.5","tph","","","CED76"
"D77A","fabric_filter","Aspiration Filter for Hulls (4.5 tph) Gravity Table (CH#3 Grading)","4.5","tph","","","CED77A"
"D77B","fabric_filter","Oats (2.5 tph) Gravity Table (CH#3 Grading)","2.5","tph","","","CED77B"
"D78","fabric_filter","Fabric Filter Receiver for Oats Transfer","","","","","CED78"
"D79","fabric_filter","Fabric Filter Receiver for Oats Transfer","","","","","CED79"
"E42","fabric_filter","Fabric Filter Receiver for Oat Hulls Loadout System","25","tph","","","CEE42"
"E43","fabric_filter","Fabric Filter Receiver for Oat Hulls Loadout System","25","tph","","","CEE43"
"EUA01","other","Grain Handling System","","","","",""
"EUA07","other","Hull Transfer System","","","","",""
"EUA13","other","Transfer / Conveying System","","","","",""
"EUA17","other","Grain Unloading & Transfer System A","","","","",""
"EUA18","other","Grain Unloading & Transfer System B","","","","",""
"EUA21","other","Transfer / Conveying System A","","","","",""
"EUA25","other","Aeration Bin 124","","","","",""
"EUA26","other","Aeration Bin 126","","","","",""
"EUA27","other","Aeration Bin 128","","","","",""
"EUA28","other","Aeration Bin 130","","","","",""
"EUA29","other","Aeration Bin 132","","","","",""
"EUA30","other","Aeration Bin 134","","","","",""
"EUA31","other","Aeration Bin 158","","","","",""
"EUA32","other","Aeration Bin 160","","","","",""
"EUA33","other","Aeration Bin 162","","","","",""
"EUA34","other","Aeration Bin 164","","","","",""
"EUA37","other","Grain Cleaning & Elevator Legs","","","","",""
"EUA38","other","Bin Top Grain Handling System A","","","","",""
"EUA39","other","Grain Handling System","","","","",""
"EUA40","other","Screenings Storage Bin, CH #1","","","","",""
"EUA41","other","Basement Grain Handling System A","","","","",""
"EUA42","other","Bin Top Grain Handling System B","","","","",""
"EUA43","other","Basement Grain Handling System A","","","","",""
"EUA44","other","Basement Grain Handling System B","","","","",""
"EUA45","other","Aeration Bin 58","","","","",""
"EUA46","other","Aeration Bin 60","","","","",""
"EUA47","other","Aeration Bin 62","","","","",""
"EUA48","other","Aeration Bin 64","","","","",""
"EUA49","other","Aeration Bin 66","","","","",""
"EUA50","other","Aeration Bin 68","","","","",""
"EUA51","other","Aeration Bin 78","","","","",""
"EUA52","other","Aeration Bin 80","","","","",""
"EUA53","other","Aeration Bin 82","","","","",""
"EUA54","other","Aeration Bin 84","","","","",""
"EUA55","other","Aeration Bin 86","","","","",""
"EUA56","other","Aeration Bin 88","","","","",""
"EUA57","other","Aeration Bin 90","","","","",""
"EUA58","other","Aeration Bin 92","","","","",""
"EUA59","other","Aeration Bin 102","","","","",""
"EUA60","other","Aeration Bin 104","","","","",""
"EUA61","other","Aeration Bin 106","","","","",""
"EUA62","other","Aeration Bin 108","","","","",""
"EUA63","other","Aeration Bin 110","","","","",""
"EUA64","other","Aeration Bin 112","","","","",""
"EUA65","other","Aeration Bin 114","","","","",""
"EUA66","other","Aeration Bin 116","","","","",""
"EUA67","other","Aeration Bin 136","","","","",""
"EUA68","other","Aeration Bin 138","","","","",""
"EUB04","other","Corn Mills Cleaning House Process","","","","",""
"EUB07","other","#3 PMC Trim Cutter","","","","",""
"EUB08","other","Corn Milling Process A, Mill A","","","","",""
"EUB09","other","Corn Mill A General Process Dust Filter","","","","",""
"EUB10A","other","Corn Milling Process C, Mill A","","","","",""
"EUB10B","other","Snack Grits","","","","",""
"EUB11","other","Snack Grits Gravity Table","","","","",""
"EUB22","other","Bran Grinder System, Corn Mill","","","","",""
"EUB24","other","Corn Mill Fine Grinder","","","","",""
"EUB25","other","Corn Milling Process A & B, Mill B","","","","",""
"EUB26","other","Corn Milling Mill A, Grit & Germ Separation","","","","",""
"EUB27","other","Corn Mill A Flour Grinder I Exhaust","","","","",""
"EUB28","other","Corn Mill A Flour Grinder II Exhaust","","","","",""
"EUB29","other","Grits Drum Dryers #1-4 Exhaust","","","","",""
"EUB30","other","Grits Drum Dryers #5-8 Exhaust","","","","",""
"EUB31","other","Cooked Grits Dust Collection Exhaust","","","","",""
"EUB33","other","Corn Mill B, Finished Product Dryer","","","","",""
"EUB34","other","Corn Milling Process C, Mill B","","","","",""
"EUB35","other","Corn Mill A & B Hominy System Grinder","","","","",""
"EUB36","other","Corn Mill Dry Mix Hopper","","","","",""
"EUD01","other","Primary Large Oat Aspiration #1","","","","",""
"EUD02","other","Primary Large Oat Aspiration #2","","","","",""
"EUD03","other","Oat Cleaning Process System A","","","","",""
"EUD04","other","Primary Large Oat Aspiration #3","","","","",""
"EUD05","other","General Dust Collection","","","","",""
"EUD06","other","Oats Dryer / Cooler #1","","","","",""
"EUD07","other","Oat Cleaning Process System C","","","","",""
"EUD08","other","Oats Dryer / Cooler #2","","","","",""
"EUD09","other","Oats Dryer / Cooler #3","","","","",""
"EUD10","other","Oats Dryer / Cooler #4","","","","",""
"EUD11","other","Oats Dryer / Cooler #5","","","","",""
"EUD12","other","Oats Dryer / Cooler #6","","","","",""
"EUD13","other","Oats Dryer / Cooler #7","","","","",""
"EUD14","other","Oat Cleaning Process System D","","","","",""
"EUD15","other","Secondary Large Oat Aspiration #1","","","","",""
"EUD16","other","Secondary Large Oat Aspiration #2","","","","",""
"EUD17","other","Oats Transfer / Packaging System A","170","tons/hour","","",""
"EUD18","other","Secondary Large Oat Aspiration #3","","","","",""
"EUD19","other","Primary Stub Oat Aspiration","","","","",""
"EUD20","other","Secondary Stub Oat Aspiration","","","","",""
"EUD21","other","Oat Rolling and Transfer System A","5176","tons/hour","","",""
"EUD23","other","Elevator C, Bin #3 Airlock","","","170","tons/hour",""
"EUD24","other","Pneumatic Transfer System – Steel Cut Oats","","","7123","tons/hour",""
"EUD25","other","CH2 General Dust Collection","","","","",""
"EUD26","other","CH2 Grading Gravity Tables (2)","5922","tons/hour","","",""
"EUD27","other","Oat Bran Flour Bin-top (Bin #4)","","","5737","tons/hour",""
"EUD28","other","Oat Rolling System G","","","1729","tons/hour",""
"EUD29","other","Oat Cleaning Process System K","","","5923","tons/hour",""
"EUD30","other","Oat Flour Bliss Mill System #1","","","6761","tons/hour",""
"EUD31","other","Oat Flour Filter Receiver System #1","","","6762","tons/hour",""
"EUD32","other","Oat Flour Bliss Mill System #2","","","6763","tons/hour",""
"EUD33","other","Oat Flour Filter Receiver System #2","","","6764","tons/hour",""
"EUD34","other","CH2 Grading Gravity Tables (2)","5925","tons/hour","","",""
"EUD35","other","Super Sack Flour","","","6171","tons/hour",""
"EUD36","other","Oat Flour Mill General Dust Collection System #1","","","6765","tons/hour",""
"EUD37","other","Oat Flour Mill General Dust Collection System #2","","","6766","tons/hour",""
"EUD38","other","Oat Conveying / Transfer Process B","1351","tons/hour","","",""
"EUD39","other","Pneumatic Transfer Systems – Groat Storage","","","5181","tons/hour",""
"EUD40","other","CH2 Oat Cleaning Process System E","","","6307","tons/hour",""
"EUD41","other","Project Big Oat Aspirators","","","5942","tons/hour",""
"EUD42","other","Oat Rolling System 1","","","6524","tons/hour",""
"EUD43","other","Oat Cleaning Process System F","","","5837","tons/hour",""
"EUD44","other","B-Grade, A-Grade, Instant, Track 5, Elevator D Blowers","","","4885","tons/hour",""
"EUD45","other","Oats / Instant Oats Processing / Transfer System A","","","5487","tons/hour",""
"EUD46","other","Grading Gravity Tables (2)","5752","tons/hour","","",""
"EUD47","other","CH2 General Dust Collection","","","5968","tons/hour",""
"EUD49","other","CH2 Grading Gravity Table (1)","","","5754","tons/hour",""
"EUD50","other","Oat Cleaning Process System H","","","5792","tons/hour",""
"EUD51","other","Oat Cleaning Process System I","","","5793","tons/hour",""
"EUD52","other","Oat Cleaning Process System J","","","5794","tons/hour",""
"EUD53","other","Oat Pro Processing System","","","5795","tons/hour",""
"EUD54","other","Groats Transfer System to Milling & Two Flaking Rolls Aspiration","","","4150","tons/hour",""
"EUD55","other","Oat Flour Mill General Dust Collection","","","6820","tons/hour",""
"EUD56","other","Elevator C, Bin #3","","","5560","tons/hour",""
"EUD57","other","C-Mill / Truck 13 Groat Transfer System","","","5020","tons/hour",""
"EUD58","other","SQO Storeveyor","","","7243","tons/hour",""
"EUD59","other","Project Big Oat-General Dust Collection","","","6525","tons/hour",""
"EUD60","other","Dirty Oats Filter Receiver #1","","","5391","tons/hour",""
"EUD61","other","Dirty Oats Filter Receiver #2","","","5392","tons/hour",""
"EUD62","other","300 V Gravity Table","","","5393","tons/hour",""
"EUD63","other","Light Oats Primary Aspiration Filter Receiver","","","5394","tons/hour",""
"EUD64","other","Light Oats Secondary Aspiration Filter Receiver","","","5395","tons/hour",""
"EUD65","other","Light Oats Destoner Filter Receiver","","","5396","tons/hour",""
"EUD66","other","90V Gravity Table","","","5397","tons/hour",""
"EUD67","other","Heavy Oats Primary Aspiration Filter Receiver","","","5398","tons/hour",""
"EUD68","other","Heavy Oats Secondary Aspiration Filter Receiver","","","5399","tons/hour",""
"EUD69","other","Heavy Oats Destoner Filter Receiver","","","5400","tons/hour",""
"EUD71","other","Dried Groats Aspiration Filter Receiver","","","5401","tons/hour",""
"EUD72","other","B Grade Gravity Table","","","5402","tons/hour",""
"EUD73","other","Chips Surge Bin Supply Cyclone Receiver","","","5403","tons/hour",""
"EUD74","other","General Dust Collection #1","","","5404","tons/hour",""
"EUD75","other","General Dust Collection #2","","","5405","tons/hour",""
"EUD76","other","General Sanitation Vacuum System","","","5406","tons/hour",""
"EUD77A","other","Grading Gravity Table CH #3","","","5687","tons/hour",""
"EUD77B","other","Grading Gravity Table CH #3","","","5687","tons/hour",""
"EUD78","other","A Grade Groat Transfer to C-Mill Filter Receiver","","","5407","tons/hour",""
"EUD79","other","A Grade Groat Transfer to Elevator D Filter Receiver","","","5408","tons/hour",""
"EUD80","other","B Grade Groat Transfer to C-Mill Filter Receiver","","","5409","tons/hour",""
"EUD81","other","B Grade Groat Transfer to Elevator D Filter Receiver","","","5410","tons/hour",""
"EUD82A","other","MIAG Kiln #1","","","5411","tons/hour",""
"EUD82B","other","MIAG Kiln #2","","","5412","tons/hour",""
"EUD83","other","MIAG Kiln #2","","","5412","tons/hour",""
"EUD85","other","CH2 Gravity Tables & New Aspirator","","","6280","tons/hour",""
"G11","fabric_filter","Fabric Filter Receiver for Flour Storage Bin","8.5","tph","","","CEG11"
"G12","fabric_filter","Fabric Filter Receiver for Flour Storage Bin","8.5","tph","","","CEG12"
"G13","fabric_filter","Fabric Filter Receiver for Flour Storage Bin","8.5","tph","","","CEG13"
"G14","fabric_filter","Fabric Filter Receiver for Flour Storage Bin","8.5","tph","","","CEG14"
"K03","other","Flour Package Building RTE #1 with Flash Dryer and Gas Burner","2.2","tph","","","K03A"
"K04","other","Flour Package Building RTE #2 with Flash Dryer and Gas Burner","2.2","tph","","","K04A"
"K05","other","Flour Package Building RTE #1 with Cereal Belt Dryer and Gas Burner","3.75","tph","","","K05A"
"K06","other","Flour Package Building RTE #2 with Cereal Belt Dryer and Gas Burner","3.75","tph","","","K06A"
"K07","other","Product Dryer Separator with Flash Dryer and Gas Burner","1.43","tph","","","K07A"
"K08","cooling","Cereal Cooler product from Package Building RTE #1","","","","","K08"
"K10","cooling","Cereal Cooler product from Package Building RTE #2","","","","","K10"
"K11","other","Not explicitly stated in the text, possibly a dryer or cooler","","","","","K11"
"K12A, K12B, K12C, K12D, K12E","boilers","Dryer burners for RTE #3 Cereal Belt Mixed Grain Flours","5.5","MMBtu/hr","","","K12A, K12B, K12C, K12D, K12E"
"K22, K23, K24","other","Separator #1 for Life Line #1, #2, and #3 Cereal","","","1.1","tph","K22, K23, K24"
"K25, K26, K27","dryers","Belt Dryer for Life Line #1, #2, and #3 Cereal","","","1.1","tph","K25A, K26A, K27A"
"K28, K29, K30, K32","other","Separator #2 and Cooler for Life Line #1, #2, and #3 Cereal","","","1.1","tph","K28, K29, K30, K32"
"K41, K42, K43, K46, K48, K49, K50","baghouses","Fabric Filter for Low Storage Bin and Life Line #4 Cereal","","","1.1","tph","K41, K42, K43, K46, K48, K49, K50"
"K64","drying","Dryer Separator associated with RTE #4 product flour","","","7500","lb/hr (wet basis)","K64A"
"K68","drying","Cereal Belt Dryer associated with flour","","","7500","lb/hr (wet basis)","K68A"
"K69","cooling","Cereal Cooler associated with flour","","","7500","lb/hr (wet basis)",""
"K81","other","Pellet Cyclone associated with flour","","","8800","lb/hr (combined)",""
"K82, K83","cooling","Cooler & Conveying of Flour Pellets","","","8800","lbs/hr",""
"K84, K85, K86","drying","Belt Dryer for Flour Pellets - Zones 1-3","4.4","tph","","","K84A, K85A, K86A"
"K87","cooling","Belt Cooler for Flour Pellets / Canopy Exhaust","4.4","tph","","",""
"K88, K89, K90","drying","Belt Dryer for Flour Pellets - Zones 1-3 (Life Line #6)","4.4","tph","","","K88A, K89A, K90A"
"L01-L10","boilers","Boilers for Natural Gas Combustion - Units 1-10","11.824","MMBtu/hr","","",""
"S01","fabric_filter","Fabric Filter System for Oat Squares (Wheat)","","","3.75","tph","CES01"
"S02","fabric_filter","Fabric Filter System for Oat Squares (Wheat)","","","","","CES02"
"S03","fabric_filter","Fabric Filter System for Oat Squares (Sugar)","","","","","CES03"
"S04","fabric_filter","Fabric Filter System for Oat Squares (Wheat)","","","","","CES04"
"S05","fabric_filter","Fabric Filter System for Oat Squares (Bicarbonate)","","","","","CES05"
"S06","fabric_filter","Fabric Filter System for Oat Squares (Bicarbonate)","","","","","CES06"
"S07","fabric_filter","Fabric Filter System for Oat Squares (Carbonate)","","","","","CES07"
"S08","fabric_filter","Fabric Filter System for Oat Squares (Carbonate)","","","","","CES08"
"S09","fabric_filter","Fabric Filter System for Dry Material (3.75 tph)","3.75","tph","","","CES09"
"S10","fabric_filter","Fabric Filter System for Oats","","","","","CES10"
"S11","fabric_filter","Fabric Filter System for Oats","","","","","CES11"
"S12","fabric_filter","Fabric Filter System for Dry Material","","","","","CES12"
"S13","fabric_filter","Fabric Filter System for Oats","","","","","CES13"
"S14","fabric_filter","Fabric Filter System for Oats","","","","","CES14"
"S16","fabric_filter","Fabric Filter System for Dry Material","","","","","CES16"
"S17","fabric_filter","Fabric Filter System for Oats","","","","","CES17"
"S18","fabric_filter","Fabric Filter System for Oats","","","","","CES18"
"S19","fabric_filter","Fabric Filter System for Oats","","","","","CES19"
